### ISSUE TITLE
Server poll every 20 seconds or so keeping device power high.

### ISSUE THREAD

**Issue by 1ubuntuuser** [tuya/TuyaOpen#89]
I upgraded from the older tuya link iot SDK. Everything is working very well, but I am facing the same issue I had on the previous SDK.

Every 20 seconds or so the tuya server sends an empty ACK and wakes up my 4G system, increasing it's battery usage. I've spent many days going through all the code and can't find any configuration for it. Does anyone know how to turn this off or decrease it's freaqancy?

Is there perhaps some product settings on Tuya Platform I need to change?

```  18.184.31.90.8883 > 192.168.43.100.55058: Flags [.], cksum 0xdb73 (correct), seq 802105129, ack 3926107897, win 7, options [nop,nop,TS val 4070293086 ecr 613664218], length 0

08:05:01.760851 IP (tos 0x0, ttl 63, id 57626, offset 0, flags [DF], proto TCP (6), length 52)
    192.168.43.100.55058 > 18.184.31.90.8883: Flags [.], cksum 0x0cc1 (correct), seq 1, ack 1, win 1002, options [nop,nop,TS val 613686998 ecr 4070256689], length 0

08:05:24.080514 IP (tos 0x0, ttl 252, id 37985, offset 0, flags [DF], proto TCP (6), length 52)
    18.184.31.90.8883 > 192.168.43.100.55058: Flags [.], cksum 0x2a78 (correct), seq 0, ack 1, win 7, options [nop,nop,TS val 4070315613 ecr 613686998], length 0

08:05:24.081066 IP (tos 0x0, ttl 63, id 57627, offset 0, flags [DF], proto TCP (6), length 52)
    192.168.43.100.55058 > 18.184.31.90.8883: Flags [.], cksum 0xb590 (correct), seq 1, ack 1, win 1002, options [nop,nop,TS val 613709318 ecr 4070256689], length 0

08:05:46.563651 IP (tos 0x0, ttl 252, id 37987, offset 0, flags [DF], proto TCP (6), length 52)
    18.184.31.90.8883 > 192.168.43.100.55058: Flags [.], cksum 0x7b47 (correct), seq 0, ack 1, win 7, options [nop,nop,TS val 4070338141 ecr 613709318], length 0

08:05:46.564179 IP (tos 0x0, ttl 63, id 57628, offset 0, flags [DF], proto TCP (6), length 52)
    192.168.43.100.55058 > 18.184.31.90.8883: Flags [.], cksum 0x5dbc (correct), seq 1, ack 1, win 1002, options [nop,nop,TS val 613731802 ecr 4070256689], length 0

08:06:09.280550 IP (tos 0x0, ttl 252, id 37989, offset 0, flags [DF], proto TCP (6), length 52)
    18.184.31.90.8883 > 192.168.43.100.55058: Flags [.], cksum 0xcb72 (correct), seq 0, ack 1, win 7, options [nop,nop,TS val 4070360669 ecr 613731802], length 0

08:06:09.281136 IP (tos 0x0, ttl 63, id 57629, offset 0, flags [DF], proto TCP (6), length 52)
    192.168.43.100.55058 > 18.184.31.90.8883: Flags [.], cksum 0x04ff (correct), seq 1, ack 1, win 1002, options [nop,nop,TS val 613754519 ecr 4070256689], length 0
```
